{
  "id": "default",
  "label": "Default",
  "number_patterns": [
    "\\b[A-Z]{2,5}(?:-[A-Z0-9]{1,6}){3,7}\\b",
    "\\b[A-Z]{1,3}-\\d{2,5}[A-Z]?\\b",
    "\\b[A-Z]{1,3}\\d{3,5}[A-Z]?\\b",
    "\\b\\d{3,6}-[A-Z]{1,3}-\\d{2,4}\\b"
  ],
  "number_labels": [
    "drawing no",
    "drawing number",
    "dwg no",
    "dwg number",
    "drg no",
    "sheet no",
    "sheet number",
    "document no",
    "document number",
    "doc no",
    "ref no",
    "ref"
  ],
  "revision_patterns": [
    "\\b(?:REV(?:ISION)?\\.?\\s*[:\\-]?\\s*)([A-Z]{1,2}\\d{0,2})\\b",
    "\\b([PCTS]\\d{2})\\b",
    "\\b(?:REV(?:ISION)?\\.?\\s*[:\\-]?\\s*)(\\d{1,2})\\b"
  ],
  "revision_labels": ["rev", "revision", "rev no", "issue"],
  "title_labels": ["drawing title", "sheet name", "sheet title", "title", "description"],
  "scale_labels": ["scale", "scales"],
  "revision_scheme": "unknown",
  "list_column_mapping": {}
}
